{"artifact_digest":"sha256:568d9671125a7c44215327e92f08fc2d8f40578c289551d19e59f5ab6c55bb86","format":"invarlock/evaluation-run-v1","records":[{"context":{"harness":{"context_token_ids":[464,3139,286,4881,318],"continuation_token_ids":[6342],"decoded_continuation":" Paris","input_utf8_byte_count":24,"is_greedy":false,"joined_token_ids":[464,3139,286,4881,318,6342],"request_index":0,"result":[-10.829025268554688,false]},"model_id":"sshleifer/tiny-gpt2","model_revision":"5f91d94bd9cd7190a9f3216ff93cd1dd95f2c7be"},"error":null,"expected":" Paris","id":"capital","input":"The capital of France is","likelihood":{"artifact_digest":"sha256:568d9671125a7c44215327e92f08fc2d8f40578c289551d19e59f5ab6c55bb86","basis":"reference_continuation","configuration_digest":"sha256:b2025ac2907b727d9520440d0dc9bb732b4278cd27006a42af5d327cf96fd3d0","input_digest":"sha256:36e5ece7c0081f589ab2bba7ffe9edcc6e7d0915eba291aba3308ef03b7706d1","logprob_sum":-10.829025268554688,"reference_digest":"sha256:4cf3ba1992ee37d8d827f6eb02657cdc34438134839af17dfe0f0c1def7b8d37","source":{"name":"lm-eval","version":"0.4.12"},"token_count":1,"tokenizer_digest":"sha256:459ad297be11581d1d91552f64afe52ebc1c0e317985c3469ed3558af9a4764f","utf8_byte_count":6},"metadata":{},"output":null,"scores":{}},{"context":{"harness":{"context_token_ids":[7571,5556,734,21767],"continuation_token_ids":[1440],"decoded_continuation":" four","input_utf8_byte_count":19,"is_greedy":false,"joined_token_ids":[7571,5556,734,21767,1440],"request_index":1,"result":[-10.85575008392334,false]},"model_id":"sshleifer/tiny-gpt2","model_revision":"5f91d94bd9cd7190a9f3216ff93cd1dd95f2c7be"},"error":null,"expected":" four","id":"arithmetic","input":"Two plus two equals","likelihood":{"artifact_digest":"sha256:568d9671125a7c44215327e92f08fc2d8f40578c289551d19e59f5ab6c55bb86","basis":"reference_continuation","configuration_digest":"sha256:b2025ac2907b727d9520440d0dc9bb732b4278cd27006a42af5d327cf96fd3d0","input_digest":"sha256:e0d0bfbc8864e13ea078e2897115a01d9b7924c2ed8721ac1fa03cd7239c18b1","logprob_sum":-10.85575008392334,"reference_digest":"sha256:fd4a995b674d25c0a0cf28cf57823124c8f245303e18e18884e82e249ea32af1","source":{"name":"lm-eval","version":"0.4.12"},"token_count":1,"tokenizer_digest":"sha256:459ad297be11581d1d91552f64afe52ebc1c0e317985c3469ed3558af9a4764f","utf8_byte_count":5},"metadata":{},"output":null,"scores":{}},{"context":{"harness":{"context_token_ids":[464,1598,32899,6766,3073],"continuation_token_ids":[4171],"decoded_continuation":" blue","input_utf8_byte_count":27,"is_greedy":false,"joined_token_ids":[464,1598,32899,6766,3073,4171],"request_index":2,"result":[-10.854894638061523,false]},"model_id":"sshleifer/tiny-gpt2","model_revision":"5f91d94bd9cd7190a9f3216ff93cd1dd95f2c7be"},"error":null,"expected":" blue","id":"color","input":"The clear daytime sky looks","likelihood":{"artifact_digest":"sha256:568d9671125a7c44215327e92f08fc2d8f40578c289551d19e59f5ab6c55bb86","basis":"reference_continuation","configuration_digest":"sha256:b2025ac2907b727d9520440d0dc9bb732b4278cd27006a42af5d327cf96fd3d0","input_digest":"sha256:5a81dca78f240f9c44a9b002c0ca7d646095158ba9d133fd8cf9f715538eec26","logprob_sum":-10.854894638061523,"reference_digest":"sha256:40aba74b88a78c02beeb35d23ad06ee6f6b1d2e525bc0346692a8b1be87de034","source":{"name":"lm-eval","version":"0.4.12"},"token_count":1,"tokenizer_digest":"sha256:459ad297be11581d1d91552f64afe52ebc1c0e317985c3469ed3558af9a4764f","utf8_byte_count":5},"metadata":{},"output":null,"scores":{}},{"context":{"harness":{"context_token_ids":[464,1306,1271,706,3598,318],"continuation_token_ids":[3624],"decoded_continuation":" eight","input_utf8_byte_count":30,"is_greedy":false,"joined_token_ids":[464,1306,1271,706,3598,318,3624],"request_index":3,"result":[-10.827911376953125,false]},"model_id":"sshleifer/tiny-gpt2","model_revision":"5f91d94bd9cd7190a9f3216ff93cd1dd95f2c7be"},"error":null,"expected":" eight","id":"sequence","input":"The next number after seven is","likelihood":{"artifact_digest":"sha256:568d9671125a7c44215327e92f08fc2d8f40578c289551d19e59f5ab6c55bb86","basis":"reference_continuation","configuration_digest":"sha256:b2025ac2907b727d9520440d0dc9bb732b4278cd27006a42af5d327cf96fd3d0","input_digest":"sha256:fef53f14be84e8ec3c775399def92a9d105a847c5f9ad708156b708ad25f0a3f","logprob_sum":-10.827911376953125,"reference_digest":"sha256:9ddc313c2f4fdb0f38ad5e8670811ebb48ccb792086b90b968558aae5693e0a4","source":{"name":"lm-eval","version":"0.4.12"},"token_count":1,"tokenizer_digest":"sha256:459ad297be11581d1d91552f64afe52ebc1c0e317985c3469ed3558af9a4764f","utf8_byte_count":6},"metadata":{},"output":null,"scores":{}},{"context":{"harness":{"context_token_ids":[1135,1138,379,262],"continuation_token_ids":[40304],"decoded_continuation":" café","input_utf8_byte_count":13,"is_greedy":false,"joined_token_ids":[1135,1138,379,262,40304],"request_index":4,"result":[-10.859746932983398,false]},"model_id":"sshleifer/tiny-gpt2","model_revision":"5f91d94bd9cd7190a9f3216ff93cd1dd95f2c7be"},"error":null,"expected":" café","id":"unicode","input":"We met at the","likelihood":{"artifact_digest":"sha256:568d9671125a7c44215327e92f08fc2d8f40578c289551d19e59f5ab6c55bb86","basis":"reference_continuation","configuration_digest":"sha256:b2025ac2907b727d9520440d0dc9bb732b4278cd27006a42af5d327cf96fd3d0","input_digest":"sha256:e3f2382d132411024904b844f84a7a24fc5a7cb6f226657ab12e00f9adeeab05","logprob_sum":-10.859746932983398,"reference_digest":"sha256:e709ab89ad83b3b91b28b3eb1ca7895b7e08c96b91785f2e5743ede3d99faf57","source":{"name":"lm-eval","version":"0.4.12"},"token_count":1,"tokenizer_digest":"sha256:459ad297be11581d1d91552f64afe52ebc1c0e317985c3469ed3558af9a4764f","utf8_byte_count":6},"metadata":{},"output":null,"scores":{}},{"context":{"harness":{"context_token_ids":[32,1790,31933,318],"continuation_token_ids":[23748,995],"decoded_continuation":" hello world","input_utf8_byte_count":19,"is_greedy":false,"joined_token_ids":[32,1790,31933,318,23748,995],"request_index":5,"result":[-21.588947296142578,false]},"model_id":"sshleifer/tiny-gpt2","model_revision":"5f91d94bd9cd7190a9f3216ff93cd1dd95f2c7be"},"error":null,"expected":" hello world","id":"sentence","input":"A short greeting is","likelihood":{"artifact_digest":"sha256:568d9671125a7c44215327e92f08fc2d8f40578c289551d19e59f5ab6c55bb86","basis":"reference_continuation","configuration_digest":"sha256:b2025ac2907b727d9520440d0dc9bb732b4278cd27006a42af5d327cf96fd3d0","input_digest":"sha256:820c2be5d03a6f1d7597070c127f756a96dbf85d7e0902f83a4975cd28b08c75","logprob_sum":-21.588947296142578,"reference_digest":"sha256:a37f39b7cae3ad236499801eb5c289859de4437be9baa5dfdea837f24dbf8f1a","source":{"name":"lm-eval","version":"0.4.12"},"token_count":2,"tokenizer_digest":"sha256:459ad297be11581d1d91552f64afe52ebc1c0e317985c3469ed3558af9a4764f","utf8_byte_count":12},"metadata":{},"output":null,"scores":{}}],"run_id":"baseline","score_provenance":{},"source":{"name":"lm-eval","version":"0.4.12"},"source_digest":"sha256:b680ed88e66f26db180596204e6f817616e9c0d8501838af2c6ba060c0cb382f"}
